URL,Version,Status,OIDs,Name,Title,Descriptino,Uses,Used,Sources
http://fhir.kl.dk/term/ValueSet/CancellationTypes,2.0.0,active,,CancellationTypes,CancellationTypes,"Cancellation valueset, to be implemented in KL-term and FKI",,"Internal"
http://fhir.kl.dk/term/ValueSet/KLCarePlanCategoryCodes,2.0.0,active,,KLCarePlanCategoryCodes,KLIndsatsforløbTypekoder,"Codes for constraining the CarePlan category",,"Internal"
http://fhir.kl.dk/term/ValueSet/KLChangeValueCodes,2.0.0,active,,KLChangeValueCodes,KLMåltypeKoder,"Change values for goals (måltype). Express the target value for change of a condition",,
http://fhir.kl.dk/term/ValueSet/KLChangeValueCodesFFB,2.0.0,active,,KLChangeValueCodesFFB,KLMåltypekoderFFB,"Change values for goals in FFB (FFB måltype). Express the target value for change of an activity or participation condition",,"Internal"
http://fhir.kl.dk/term/ValueSet/KLChangeValueCodesFSIII,2.0.0,active,,KLChangeValueCodesFSIII,KLMåltypeKoderFSIII,"Change values for goals in FSIII (FSIII måltype). Express the target value for change of a health condition or funtional condition",,"Internal"
http://fhir.kl.dk/term/ValueSet/KLCitizenObservationCodesFSIII,2.0.0,active,,KLCitizenObservationCodesFSIII,KLBorgervurderingsObservationskoderFSIII,"Observation codes for citizens own observations as defined by FSIII",,"Internal"
http://fhir.kl.dk/term/ValueSet/KLCitizenObservationResultCodesFSIII,2.0.0,active,,KLCitizenObservationResultCodesFSIII,KLBorgervurderingsResultatkoderFSIII,"Performance and Importance level codes, as evaluated by the citizen",,
http://fhir.kl.dk/term/ValueSet/KLComplicationCodesSCT,2.0.0,active,,KLComplicationCodesSCT,KLKomplikationskoderSCT,"Codes that indicate whether an intervention had complications or not",,"SCT"
http://fhir.kl.dk/term/ValueSet/KLConditionADCodesFFB,2.0.0,active,,KLConditionADCodesFFB,KLTilstandADKoderFFB,"Danish municipality FFB condition codes for Activities and Participation",,"Internal"
http://fhir.kl.dk/term/ValueSet/KLConditionCodes,2.0.0,active,,KLConditionCodes,KLTilstandKoder,"Danish municipality condition codes",,
http://fhir.kl.dk/term/ValueSet/KLConditionCodesFFB,2.0.0,active,,KLConditionCodesFFB,KLTilstandKoderFFB,"Danish municipality FFB condition codes",,
http://fhir.kl.dk/term/ValueSet/KLConditionCodesFSIII,2.0.0,active,,KLConditionCodesFSIII,KLTilstandKoderFSIII,"Danish municipality FSIII condition codes",,
http://fhir.kl.dk/term/ValueSet/KLConditionCodesHomeCare,2.0.0,active,,KLConditionCodesHomeCare,KLTilstandeKoderHjemmepleje,"Danish municipality home care condition codes (funktionsevnetilstande)",,"Internal"
http://fhir.kl.dk/term/ValueSet/KLConditionCodesNursing,2.0.0,active,,KLConditionCodesNursing,KLTilstandeKoderSygepleje,"Danish municipality nursing condition codes",,"Internal"
http://fhir.kl.dk/term/ValueSet/KLConditionCodesPrevention,2.0.0,active,,KLConditionCodesPrevention,KLTilstandKoderForebyggelse,"Danish municipality Prevention condition codes",,"Internal"
http://fhir.kl.dk/term/ValueSet/KLConditionCodesTheraphy,2.0.0,active,,KLConditionCodesTheraphy,KLTilstandKoderTræning,"Danish municipality theraphy condition codes",,"Internal"
http://fhir.kl.dk/term/ValueSet/KLConditionFFCodesFFB,2.0.0,active,,KLConditionFFCodesFFB,KLTilstandFFKoderFFB,"Danish municipality FFB condition codes for body functions and structures",,"Internal"
http://fhir.kl.dk/term/ValueSet/KLConditionOCodesFFB,2.0.0,active,,KLConditionOCodesFFB,KLTilstandOKoderFFB,"Danish municipality FFB condition codes for Environmental Factors",,"Internal"
http://fhir.kl.dk/term/ValueSet/KLConditionsAndTargetGroupsFFB,2.0.0,active,,KLConditionsAndTargetGroupsFFB,KLTilstandeOgMålgrupperFFB,"Conditions and target groups as defined by FFB",,
http://fhir.kl.dk/term/ValueSet/KLConsentToLiasing,2.0.0,active,,KLConsentToLiasing,KLBorgerIndforståetMedHenvendelseKoder,"Codes for citizens knowledge of referal/request as defined by FFB",,"Internal"
http://fhir.kl.dk/term/ValueSet/KLEncounterTypes,2.0.0,active,,KLEncounterTypes,KLKontaktTyper,"Encounter types in Danish municipality health, social and elderly care (note that these are specific to this model, they are not replicas of a municipality terminology service)",,"Internal"
http://fhir.kl.dk/term/ValueSet/KLEvaluationTypeCodes,2.0.0,active,,KLEvaluationTypeCodes,KLVurderingTypekoder,"Codes used to distinguish different kinds of evaluations",,"Internal"
http://fhir.kl.dk/term/ValueSet/KLEvaluationTypeCodesSCT,2.0.0,active,,KLEvaluationTypeCodesSCT,KLVurderingTypekoderSCT,"SNOMED CT codes used to distinguish different kinds of evaluations",,"SCT"
http://fhir.kl.dk/term/ValueSet/KLFollowUpCodes,2.0.0,active,,KLFollowUpCodes,KLOpfølgningKodes,"Follow-up codes used in Danish municipalities",,
http://fhir.kl.dk/term/ValueSet/KLFollowUpCodesFFB,2.0.0,active,,KLFollowUpCodesFFB,KLOpfølgningKoderFFB,"Follow-up codes used in FFB",,"Internal"
http://fhir.kl.dk/term/ValueSet/KLFollowUpCodesFSIII,2.0.0,active,,KLFollowUpCodesFSIII,KLOpfølgningKoderFSIII,"Follow-up codes used in FSIII",,"Internal"
http://fhir.kl.dk/term/ValueSet/KLGeneralInformationFSIII,2.0.0,active,,KLGeneralInformationFSIII,KLGenerelInformationFSIII,"Generel information codes (observations) as defined by FSIII",,"Internal"
http://fhir.kl.dk/term/ValueSet/KLGoalTypeCodes,2.0.0,active,,KLGoalTypeCodes,KLMålKategoriKoder,"Codes used to distinguish different kinds of goals",,"Internal"
http://fhir.kl.dk/term/ValueSet/KLHomeCareAreasFSIII,2.0.0,active,,KLHomeCareAreasFSIII,KLHjemmeplejeOmråderFSIII,"Observation codes for the five home care areas as defined by FSIII",,"Internal"
http://fhir.kl.dk/term/ValueSet/KLHomeCareInterventionsFSIII,2.0.0,active,,KLHomeCareInterventionsFSIII,KLHjemmeplejeIndsatserFSIII,"Home Care Interventions as described by FSIII",,"Internal"
http://fhir.kl.dk/term/ValueSet/KLImportanceLevelCodesFSIII,2.0.0,active,,KLImportanceLevelCodesFSIII,KLBetydningKoderFSIII,"Importance level codes (Betydning), as evaluated by the citizen",,"Internal"
http://fhir.kl.dk/term/ValueSet/KLInformationCodes,2.0.0,active,,KLInformationCodes,KLOplysningKoder,"Information codes from FSIII and FFB (Område, Tema, Generelle oplysninger)",,
http://fhir.kl.dk/term/ValueSet/KLInformationGatheringInvestigationCodes,2.0.0,active,,KLInformationGatheringInvestigationCodes,KLOplysningsaktivitetsOgVurderingskoder,"Codes that identify valid items in an investigation in Danish municipalities",,
http://fhir.kl.dk/term/ValueSet/KLInformationGatheringTypeCodes,2.0.0,active,,KLInformationGatheringTypeCodes,KLOplysningsaktivitetsTypeKoder,"Codes used to specify which kind of information gathering is conducted",,"Internal"
http://fhir.kl.dk/term/ValueSet/KLInterventions,2.0.0,active,,KLInterventions,KLIndsatser,"Interventions as described by FSIII and FFB",,
http://fhir.kl.dk/term/ValueSet/KLInterventionsFFB,2.0.0,active,,KLInterventionsFFB,KLYdelserFFB,"social interventions (ydelser) as defined by FFB",,"Internal"
http://fhir.kl.dk/term/ValueSet/KLInterventionsFSIII,2.0.0,active,,KLInterventionsFSIII,KLIndsatserFSIII,"Interventions as described by FSIII",,
http://fhir.kl.dk/term/ValueSet/KLMatterOfInterestInformerFFB,2.0.0,active,,KLMatterOfInterestInformerFFB,KLKildeTilOplysningFFB,"Codes that identify who's perspective the matter-of-interest is comming from",,"Internal"
http://fhir.kl.dk/term/ValueSet/KLMatterOfInterestValues,2.0.0,active,,KLMatterOfInterestValues,KLIngenOplysningerKoder,"Matter of interest values to support when no observations have been made",,"Internal"
http://fhir.kl.dk/term/ValueSet/KLNeedsAssessmentCodesFFB,2.0.0,active,,KLNeedsAssessmentCodesFFB,KLStøttebehovsvurderingskoderFFB,"Needs assesment codes as defined in FFB",,"Internal"
http://fhir.kl.dk/term/ValueSet/KLNursingAreasFSIII,2.0.0,active,,KLNursingAreasFSIII,KLSygeplejeOmråderFSIII,"Observation codes for the 12 nursing areas as defined by FSIII",,"Internal"
http://fhir.kl.dk/term/ValueSet/KLNursingInterventionsFSIII,2.0.0,active,,KLNursingInterventionsFSIII,KLSygeplejeIndsatserFSIII,"Nursing interventions as described by FSIII",,"Internal"
http://fhir.kl.dk/term/ValueSet/KLObservationCodes,2.0.0,active,,KLObservationCodes,KLObservationskoder,"SNOMED CT and NPU codes used in Danish municipalities",,"SCT,Internal"
http://fhir.kl.dk/term/ValueSet/KLPerformanceLevelCodesFSIII,2.0.0,active,,KLPerformanceLevelCodesFSIII,KLUdførelsesKoderFSIII,"Performance level codes (Udførelse), as evaluated by the citizen",,"Internal"
http://fhir.kl.dk/term/ValueSet/KLPreventionAreasFSIII,2.0.0,active,,KLPreventionAreasFSIII,KLForebyggelseOmråderFSIII,"Prevention areas (observation codes), used for documentation within prevention and health promotion",,"Internal"
http://fhir.kl.dk/term/ValueSet/KLPreventionInterventionsFSIII,2.0.0,active,,KLPreventionInterventionsFSIII,KLForebyggelseIndsatserFSIII,"Prevention and health promotion interventions as defined by FSIII",,"Internal"
http://fhir.kl.dk/term/ValueSet/KLRequestFromFSIII,2.0.0,active,,KLRequestFromFSIII,KLHenvendelseHenvisningFraFSIII,"Type of service requesters as defined by FSIII",,"Internal"
http://fhir.kl.dk/term/ValueSet/KLServiceCodesFFB,2.0.0,active,,KLServiceCodesFFB,KLTilbudsKoderFFB,"Social service (tilbud) as defined by FFB",,"Internal"
http://fhir.kl.dk/term/ValueSet/KLServicesTypes,2.0.0,active,,KLServicesTypes,KLServiceTyper,"Types of services that the Danish municipalities provide which is covered by FSIII and FFB",,"Internal"
http://fhir.kl.dk/term/ValueSet/KLSeverities,2.0.0,active,,KLSeverities,KLSværhedgrader,"Severities related to conditions",,
http://fhir.kl.dk/term/ValueSet/KLSeveritiesFFB,2.0.0,active,,KLSeveritiesFFB,KLFunktionsevneniveauFFB,"Severities related to conditions in FFB (funktionsevneniveau)",,"Internal"
http://fhir.kl.dk/term/ValueSet/KLSeveritiesFSIII,2.0.0,active,,KLSeveritiesFSIII,KLFunktionsevneniveauFSIII,"Severities related to conditions in FSIII home care (funktionsniveau)",,"Internal"
http://fhir.kl.dk/term/ValueSet/KLTargetGroupsFFB,2.0.0,active,,KLTargetGroupsFFB,KLMålgrupperFFB,"Target groups as defined by FFB",,"Internal"
http://fhir.kl.dk/term/ValueSet/KLTargetMeasureCodes,2.0.0,active,,KLTargetMeasureCodes,KLTypeAfObservationPåMål,"Target measure code, that determines whether the target is expressed as a severity, change value or using another observation",,"Internal"
http://fhir.kl.dk/term/ValueSet/KLThemesFFB,2.0.0,active,,KLThemesFFB,KLTemaerFFB,"FFB Themes",,"Internal"
http://fhir.kl.dk/term/ValueSet/KLTheraphyAreasFSIII,2.0.0,active,,KLTheraphyAreasFSIII,KLTræningOmråderFSIII,"Theraphy areas (observation codes), used for documentation within physical training, physiotheraphy and occupational theraphy in Danish Municipalities as defined by FSIII",,"Internal"
http://fhir.kl.dk/term/ValueSet/KLTrainingInterventionsFSIII,2.0.0,active,,KLTrainingInterventionsFSIII,KLTræningIndsatserFSIII,"Training interventions as defined by FSIII",,"Internal"
